comment,contract,dollar,flatRate,levelOfReporting,paidYet,paymentDifficulty,platform,publication,relationship,rights,storyType,wordCount,year
,Contract: ,$0.43,False,Little to no reporting,Paid in 1 month ,svg-1,Platform: digital,Eater,Ongoing/pre-existing relationship with editor or publication,Rights: All rights,feature,2300,2018
,Contract: Yes,$0.45,False,Medium reporting,Paid in 1 month ,svg-1,Platform: digital,Eater,Ongoing/pre-existing relationship with editor or publication,Rights: Other / I don't know,feature,1000,2018
,Contract: Yes,$0.23,False,Medium reporting,Haven't gotten it yet (as of this reporting) ,svg-1,Platform: digital,Eater,Ongoing/pre-existing relationship with editor or publication,Rights: Other / I don't know,fob,1200,2017
,Contract: ,$0.25,False,Heavy/Investigative reporting,Paid in 2 months ,svg-3,Platform: digital,Eater,Assignment (editor came to you),Rights: Other / I don't know,feature,3000,2016
,"Contract: Verbal or ""handshake"" agreement",$0.07,False,Medium reporting,,ng-hide,Platform: digital,Eater,Cold pitch (no pre-existing relationship),Rights: ,"opinion, editorial, column or essay",~3000,2015
,Contract: Yes,$0.20,False,Medium reporting,,ng-hide,Platform: digital,Eater,Cold pitch (no pre-existing relationship),Rights: First Serial Rights,fob,~1500,2015
,Contract: Yes,$0.67,False,Medium reporting,,ng-hide,Platform: digital,Eater,Cold pitch (no pre-existing relationship),Rights: All rights,feature,~3000,2014
