comment,contract,dollar,flatRate,levelOfReporting,paidYet,paymentDifficulty,platform,publication,relationship,rights,storyType,wordCount,year
,Contract: ,$0.06,False,,Haven't gotten it yet (as of this reporting) ,svg-3,Platform: digital,The Awl,,Rights: Other / I don't know,,3500-word,2016
,Contract: No,$0.40,False,Medium reporting,,ng-hide,Platform: digital,The Awl,Ongoing/pre-existing relationship with editor or publication,Rights: ,"opinion, editorial, column or essay",~750,2015
,"Contract: Verbal or ""handshake"" agreement",$0.08,False,Medium reporting,,ng-hide,Platform: digital,The Awl,Cold pitch (no pre-existing relationship),Rights: All rights,"criticism, review, or arts/entertainment converage",~3000,2014
,"Contract: Verbal or ""handshake"" agreement",$0.08,False,Medium reporting,,ng-hide,Platform: digital,The Awl,Cold pitch (no pre-existing relationship),Rights: First Serial Rights,profile or interview,~3000,2014
"""Nice Editor, light editorial hand, published without notifying me, """,Contract: No,$0.27,False,Medium reporting,,ng-hide,Platform: digital,The Awl,Ongoing/pre-existing relationship with editor or publication,Rights: ,"opinion, editorial, column or essay",~375,2014
,Contract: ,$0.03,False,,,ng-hide,,The Awl,,Rights: ,,1000-word,2013
"""Sometimes $30 or $50, sometimes nothing, for 1000­-2000­ word essays (2011­-12). “Checks came as a pleasant surprise. I’m curious how this has changed/standardized since then.”""",Contract: ,,,,,ng-hide,,The Awl,,Rights: ,,,2013
"""""long-form, fully reported pieces.""""",Contract: ,$50,True,,,ng-hide,,The Awl,,Rights: ,, news story,2012
