comment,contract,dollar,flatRate,levelOfReporting,paidYet,paymentDifficulty,platform,publication,relationship,rights,storyType,wordCount,year
,Contract: ,$1.47,False,,Paid in 6 weeks ,svg-2,Platform: print,Time,,Rights: All rights,,1700-word,2018
,"Contract: Verbal or ""handshake"" agreement",$0.20,False,Medium reporting,Paid in 1 month ,svg-1,Platform: digital,Time,Ongoing/pre-existing relationship with editor or publication,Rights: All rights,feature,1979,2018
,Contract: Yes,$0.22,False,Medium reporting,Paid in 6 weeks ,svg-3,Platform: digital,Time,Cold pitch (no pre-existing relationship),Rights: All rights,feature,800,2017
,Contract: Yes,$0.22,False,Medium reporting,Haven't gotten it yet (as of this reporting) ,svg-3,Platform: digital,Time,Cold pitch (no pre-existing relationship),Rights: All rights,feature,800,2016
,Contract: No,$0.00,False,Little to no reporting,,ng-hide,Platform: digital,Time,Assignment (editor came to you),Rights: Other / I don't know,"opinion, editorial, column or essay",~750,2014
,Contract: No,$0.00,False,Little to no reporting,,ng-hide,Platform: digital,Time,Submission/spec (piece was written prior and then submitted for publication),Rights: Secondary Rights/Reprint,"opinion, editorial, column or essay",~375,2013
"""""took three months to get paid the first time, but only three weeks the second time.""""",Contract: ,,,,,ng-hide,Platform: print,Time,,Rights: ,,,2013
